Do verbs have suffixes/enclitics, other than those that ONLY mark A, S or O (do include portmanteau: A & S + TAM)?	1: present, 0: absent	"The portmanteau morphemes in questions could be of person, number or TAM or markers of reciprocity, location, benefactive, direction etc. If there are affixes devoted to TAM solely these are also counted. Person markings expressing more than one argument, relative markers or relative pronouns are also included here if they form a phonological units with the root. The outcome of this affixation has to be a verb, i.e. a affix that makes a verb into an instrumental noun for example would not count. This feature is not logically triggered by the following features, but if you have coded ""1"" for either of these you are advised to consider whether it would also result in a ""1"" for this feature: 152, 101, 151, 149, 82, 83, 84, 87, 88, 107, 104, 103, 147, 148, 114 and 115. The reason why there is no strict logical dependency is because while they all deal with markings on the verb, these can theoretically be other markings than prefixes, proclitics, enclitics or suffixes (reduplication, tone and suppletion). Since this kind of marking is rare, we recommend all coders being aware of this link even though it is not technically a strict dependency."	1		Vycichl (2005:226-227)		verb, bound person form, portmanteau morpheme	argument marking - core, argument marking - oblique, TAM	affixation and cliticization, bound person marking, conjugation	3	GB080		
Can infixation be used on verbs for derivational, aspectual, or voice-changing purposes?	1: present, 0: absent	This affix is stem internal, not between other affixes. Kashaya is a languge that illustrates this principle well.	0		Souag (2010:1-519)		verb	derivation, TAM, valency change	infixation	3	GB081		
Is there present tense regularly morphologically marked on the verb?	1: present, 0: absent	"This question aims at capturing overt productive paradigms of tense. ""On the verb"" here means that the marker has to form a phonological unit with the roots. This could refer to an affix, but suppletion, tonal marking and reduplication is also included.This feature aims at capturing over marking of present tense on the verb, i.e. lack of other markings is not enough. There are instances where TAM can be expressed by a combination of an affix and auxiliary, for example some grammarians state that future tense is accomplished by a certain aspect on the verbal root and an auxiliary. If this is the productive grammatical obligatory way of expression the tense in question than such a construction is allowed to trigger yes (1) for both ""on the verb ""and ""auxiliary""."	0		Vycichl (2005:1-258)		verb	TAM	conjugation	4	GB082		
Is there past tense regularly morphologically marked on the verb?	1: present, 0: absent	"This question aims at capturing productive paradigms of tense. ""On the verb"" here means that the marker has to form a phonological unit with the roots. This could refer to an affix, but suppletion, tonal marking and reduplication is also included. There are instances where TAM can be expressed by a combination of an affix and auxiliary, for example some grammarians state that future tense is accomplished by a certain aspect on the verbal root and an auxiliary. If this is the productive grammatical obligatory way of expression the tense in question than such a construction is allowed to trigger yes (1) for both ""on the verb ""and ""auxiliary""."	0		Vycichl (2005:226, 230); Souag (193-195); Lameen Souag (p.c. 2023)	There is no past tense in Siwi. According to Souag (2013), realis completed actions are expressed using perfective aspect.	verb	TAM	conjugation	2	GB083		JR
Is there future tense regularly morphologically marked on the verb?	1: present, 0: absent	"This question aims at capturing productive paradigms of tense. ""On the verb"" here means that the marker has to form a phonological unit with the roots. This could refer to an affix, but suppletion, tonal marking and reduplication is also included. There are instances where TAM can be expressed by a combination of an affix and auxiliary, for example some grammarians state that future tense is accomplished by a certain aspect on the verbal root and an auxiliary. If this is the productive grammatical obligatory way of expression the tense in question than such a construction is allowed to trigger yes (1) for both ""on the verb ""and ""auxiliary""."	0		Vycichl (2005:229); Souag (187-188); Lameen Souag (p.c. 2023)	There is no future tense in Siwi. Souag (2013) analyzes prefix 'ga-' as irrealis marker.	verb	TAM	conjugation	3	GB084		JR
Is a distinction between punctual/continuous aspect available as a morphological choice?	1: present, 0: absent	"These categories could go by the name of imperfect-perfective, preterit-progressive etc. The answer could be ""yes"" even if it's only one that is overtly marked, i.e. if imperfective is by affix and perfective by auxiliary for example. Please take notice that 310 and 86 are not covering exactly the same functions, there are more aspects than punctual/continuous."	1		Vycichl (2005:230)		verb	TAM	conjugation	2	GB086		
Is a distinction between realis/irrealis mood available as a morphological choice?	1: present, 0: absent	Markers of status (realis/irrealis) need to be dedicated to that function and possible in most TAM-contexts, it cannot be restricted to certain TAM or polarity contexts.	?		Vycichl (2005:)		verb	TAM	conjugation	3	GB087		
Is there an apprehensive modal category marked on the verb also known as 'evitative', 'lest', etc.?	1: present, 0: absent	"For example, in a sentence like ""he is sick "" can you mark ""is-sick"" with an apprehensive modal category to get the meaning he might become sick (and this is an unwanted state of affairs that one would like to avoid) ."	?		Vycichl (2005:)		verb	TAM	conjugation	3	GB088		
Is the S participant (at least sometimes) marked by a suffix/enclitic?	1: present, 0: absent	Is there a bound postverbal marker on the verb that marks for the S-participant?	1		Vycichl (2005:226-227)	The S and A participants trigger agreement on the verb. There are person pre- and suffixes.	verb, bound person form	argument marking - core	affixation and cliticization, bound person marking, conjugation, word order	2	GB089		
Is the S participant (at least sometimes) marked by a prefix/proclitic?	1: present, 0: absent	Is there a bound preverbal marker on the verb that marks for the S-participant?	1		Vycichl (2005:226-227)	The S and A participants trigger agreement on the verb. There are person pre- and suffixes.	verb, bound person form	argument marking - core	affixation and cliticization, bound person marking, conjugation, word order	2	GB090		
Is the A participant (at least sometimes) marked by a suffix/enclitic?	1: present, 0: absent	Is there a bound postverbal marker on the verb that marks for the A-participant?	1		Vycichl (2005:226-227)	The S and A participants trigger agreement on the verb. There are person pre- and suffixes.	verb, bound person form	argument marking - core	affixation and cliticization, bound person marking, conjugation, word order	2	GB091		
Is the A participant (at least sometimes) marked by a prefix/proclitic?	1: present, 0: absent	Is there a bound preverbal marker on the verb that marks for the A-participant?	1		Vycichl (2005:226-227)	The S and A participants trigger agreement on the verb. There are person pre- and suffixes.	verb, bound person form	argument marking - core	affixation and cliticization, bound person marking, conjugation, word order	2	GB092		
Is the O participant (at least sometimes) marked by a suffix/enclitic?	1: present, 0: absent	Is there a bound postverbal marker on the verb that marks for the O-participant?	1		Vycichl (2005:241)	The O participant can be expressed in form of a person suffix.	verb, bound person form	argument marking - core	affixation and cliticization, bound person marking, conjugation, word order	2	GB093		
Is the O participant (at least sometimes) marked by a prefix/proclitic?	1: present, 0: absent	Is there a bound preverbal marker on the verb that marks for the O-participant?	0		Vycichl (2005:1-258)		verb, bound person form	argument marking - core	affixation and cliticization, bound person marking, conjugation, word order	2	GB094		
Are variations in marking strategies of core participants based on TAM distinctions?	1: present, 0: absent	"By ""marking strategies of core participants"" we are referring to the placement of affix/clitic marking in relation to the verbal root. F95-98 does not relate to alignment (F141-142, F278-282) but to the prefix/proclitic & suffix/enclitic-features of F89-F94. The fact that arguments can be marked by independent pronouns or by verbal agreement only is not relevant here, it is the position in relation to the verbal root that is targeted."	0		Vycichl (2005:1-258)		verb, bound person form	argument marking - core, TAM	affixation and cliticization, bound person marking, conjugation, word order	1	GB095		
Are variations in marking strategies of core participants based on verb classes?	1: present, 0: absent	"By ""marking strategies of core participants"" we are referring to the placement of affix/clitic marking in relation to the verbal root. F95-98 does not relate to alignment (F141-142, F278-282) but to the prefix/proclitic & suffix/enclitic-features of F89-F94. The fact that arguments can be marked by independent pronouns or by verbal agreement only is not relevant here, it is the position in relation to the verbal root that is targeted."	0		Vycichl (2005:1-258)		verb, bound person form	argument marking - core, verb classification	affixation and cliticization, bound person marking, conjugation, word order	1	GB096		
Are variations in marking strategies of core participants based on clause type, e.g. main vs. subordinate?	1: present, 0: absent	"By ""marking strategies of core participants"" we are referring to the placement of affix/clitic marking in relation to the verbal root. F95-98 does not relate to alignment (F141-142, F278-282) but to the prefix/proclitic & suffix/enclitic-features of F89-F94. The fact that arguments can be marked by independent pronouns or by verbal agreement only is not relevant here, it is the position in relation to the verbal root that is targeted."	0		Vycichl (2005:1-258)		clause, verb, bound person form	argument marking - core, subordination	affixation and cliticization, bound person marking, conjugation, word order	1	GB097		
Are variations in marking strategies of core participants based on person distinctions?	1: present, 0: absent	"By ""marking strategies of core participants"" we are referring to the placement of affix/clitic marking in relation to the verbal root. F95-98 does not relate to alignment (F141-142, F278-282) but to the prefix/proclitic & suffix/enclitic-features of F89-F94. The fact that arguments can be marked by independent pronouns or by verbal agreement only is not relevant here, it is the position in relation to the verbal root that is targeted."	1		Vycichl (2005:226-227)	The S and A participants trigger agreement on the verb. There are person pre- and suffixes.	verb, bound person form	argument marking - core, person	affixation and cliticization, bound person marking, conjugation, word order	1	GB098		
Do verb stems alter according to the person of a core participant?	1: present, 0: absent	i.e. can suppletion mark person?	0		Vycichl (2005:237-238); Lameen Souag (p.c. 2023)	Using the root and pattern system, there is no strong suppletion as long as the root consonants remain the same. There is weak suppletion conditioned by person seen in the verbs for 'come' and 'go'.	verb	person	suppletion	1	GB099		JR
Are benefactive nominals marked on the verb?	1: present, 0: absent	"This question concerns a bound verbal marker that signals that the verb has a benefactive argument. The marker could be analyzed in the language-specific case as voice, agreement or a bound pronoun. The marker doesn't have to index the benefactor or benefactee. Serial-verb-constructions that include a marker of benefactive (typically the root for ""give"") do not count here."	1		Souag (2013:165); Lameen Souag (p.c. 2023)	Dative/benefactive is marked on the verb stem with dative pronominal affixes.	verb, bound person form	argument marking - oblique	affixation and cliticization, bound person marking, conjugation	2	GB103		JR
Can instruments be marked on the verb?	1: present, 0: absent	This marker doesn't have to index the instrument.	0		Souag (2010:1-519)		verb, bound person form	argument marking - oblique	affixation and cliticization, bound person marking, conjugation	2	GB104		
Can recipients be treated as a transitive object, i.e. as Direct Object?	1: present, 0: absent	F105 is concerned with both agreement on the verb and constituent marking (constituent marking = marking on the constituent that refers to the role the constituent has to the predicate, i.e. both adpositions (F76-77) and case (F71-73)). A ‘yes’ in F105 is firstly triggered by constituent marking. If there is no constituent marking of DO in the language whatsoever verbal marking is considered. See F287-F90 for further subdivisions of this feature.	1		Souag (2010:311); Souag (2015:236); Lameen Souag (p.c. 2023)	Recipients/benefactives usually take the prepositional dative marker 'i'. Some ditransitive verbs do allow the recipient to be encoded without prepositional dative marker 'I', yielding a double object construction, e.g. the verb for 'teach (by memorization)'.	noun, NP, case marker, verb, bound person form	argument marking - oblique, argument marking - core	declension, conjugation, agreement, bound person marking, phonologically independent item	1	GB105		JR
Are there syntactically ditransitive verbs?	1: present, 0: absent	Are there verbs that can take three arguments without resorting to additional clauses, adpositional phrases or other constructions? If the only instance of a potential ditransitive is ‘give’, and a particular subset of give, than F106 should be answered no (0). Multiple topic constructions of the kind in Sino-Tibetan languages also do not qualify for a yes (1) in F106.	0		Souag (2010:355)		verb	verb classification, argument marking - oblique	paradigm	2	GB106		
Is negation marked morphologically on the verb?	1: present, 0: absent	"This feature refers to Standard Negation, i.e. at least the negation of dynamic verbal predicates in declarative mood. ""On the verb"" here means that the marker has to form a phonological unit with the root. This could refer to an affix, but suppletion, tonal marking and reduplication is also included. Auxiliaries are also included in ""verbs""."	0		Souag (2010:437)	For negative imperatives, the verb stem changes from the intensive to the aorist. As this is not the default negation, I answered 0.	verb, negator	negation	conjugation	2	GB107		
Can locative or direction be morphologically marked on the verb?	1: present, 0: absent	"Serial-verb-constructions that include a marker of location (verbs meaning ""go"") do not count here."	0		Souag (2010:1-519)		verb, bound person form	argument marking - oblique	affixation and cliticization, bound person marking, conjugation	2	GB108		
Are there suppletive verbs for number of participants?	1: present, 0: absent	"Please do note that ""number of participants"" need not be the same as number of the NPs that are the arguments of the verb, i.e ""people"" can be marked as singular even though it is semantically plural. Auxiliaries are also included in ""verbs""."	0		Vycichl (2005:1-258)	Using the root and pattern system, there is no strong suppletion as long as the root consonants remain the same.	verb	number	suppletion	2	GB109		
Are there suppletive verbs for tense or aspect?	1: present, 0: absent		0		Vycichl (2005:1-258)	Using the root and pattern system, there is no strong suppletion as long as the root consonants remain the same.	verb	TAM	suppletion	3	GB110		
Are there conjugation classes?	1: present, 0: absent	"Are there different groups of verbs that take different finiteness markers. This could also be two groups of ""regular"" and ""irregular""."	1		Vycichl (2005:231-240)		verb	verb classification, TAM, person, argument marking - core, argument marking - oblique	paradigm	3	GB111		
Are there (several) verbs which can be used either transitively or intransitively with no morphological marking?	1: present, 0: absent	In order for a 'yes'(1) here it needs to be true of more than two verbal roots.	1		Souag (2010:360)		verb	verb classification, derivation, argument marking - core	none	2	GB112		
Is there transitivising morphology (include clitics)?	1: present, 0: absent	"Is there morphology that increases the valency from 1 to 2, i.e. makes an intransitive verb transitive? Markers that increase the valency of already transitive verbs do not count (instrumental and benefactives), nor do causatives (2 -> 3). Here is an example from Tok Pisin:""mi silip long graun"" for ""I am sleeping on the ground"" versus ""mi silipim ston long graun"" for ""I put the stone on the ground""."	1		Vycichl (2005:239); Souag (2013:177); Lameen Souag (p.c. 2023)	Causative is morphologically marked on the verb with prefix 's-'.	verb	derivation, valency change, causative	affixation and cliticization, infixation, tone, alternation, reduplication	2	GB113		JR
Is there morphology (include clitics) to mark a reflexive action?	1: present, 0: absent	This feature pertains to bound verbal marking. Phonologically independent elements do not count here, nor does coreference of person or number with the subject.	0		Vycichl (2005:221); Souag (2013:247, 258); Lameen Souag (p.c. 2023)	Siwi has phonologically independent reflexive pronouns.	verb	derivation, valency change	affixation and cliticization, infixation, tone, alternation, reduplication	2	GB114		JR
Is there morphology (include clitics) to mark a reciprocal action?	1: present, 0: absent	This feature pertains to bound verbal marking. Phonologically independent elements do not count here, nor does coreference of person or number with the subject.	0		Vycichl (2005:in passim); Lameen Souag (p.c. 2023)		verb	derivation, valency change	affixation and cliticization, infixation, tone, alternation, reduplication	2	GB115		JR
Do verbs classify the shape, size, consistency or position of absolutive arguments by means of incorporated nouns, verbal affixes or suppletive verb stems?	1: present, 0: absent	This questions aims at capturing verbal classifier systems, these systems are not based on agreement with the noun class system (Aikhenvald 2000:149). The system can however be identical or very similar to the possessive, numeral or demonstrative classifier systems.	0		Vycichl (2005:1-258)		classifier, noun, verb	nominal classification	affixation and cliticization, agreement, suppletion, compounding and incorporation, conjugation	4	GB116		
Is there a copula for predicate nominals?	1: present, 0: absent	This linker does not have to be a finite verb, it could be a demonstrative.	0		Vycichl (2005:254)		demonstrative, copula, verb, auxiliary	predication	phonologically independent item	4	GB117		
Are there serial verb constructions?	1: present, 0: absent	Serial verbs are two or more verbs in juxtaposition, functioning as a single predicate, with no morphology to mark their relationship with each other. Each of the verbs is a separate phonological word but the construction as a whole is expressed in one intonational unit. Morphology is shared to a greater or lesser extent. Serial verbs are different from clause-chaining because the verbs involved in clause-chaining lack finiteness and cannot occur independently in that form whereas serial verbs take the appropriate finiteness marking. Serial verbs are different from compounds because they can each take their own arguments whereas the roots of a compound share arguments.	0		Vycichl (2005:1-258)		verb, serial verb construction	predication	specialized construction	3	GB118		
Is verb compounding a regular process?	1: present, 0: absent	Verbal compounding is two or more verb stems acting as one phonological and grammatical word. Verb compounds share the same arguments. Languages with serial verbs can often have verb compounds too, however they might not always be described as such.	0		Vycichl (2005:1-258)		verb	predication, derivation	specialized construction, compounding and incorporation	2	GB122		
Are there verb-adjunct (aka light-verb) constructions?	1: present, 0: absent	"This question concerns constructions involving a non-predicating element expressing the lexical meaning of the construction, in conjunction with a semantically fairly empty verb, which enables the element to function as a predicate by providing the necessary morphology, e.g. 'eye do' for 'see'; or 'sneeze hit' for 'sneeze'. Exclude constructions that fall into the categories of verb compounding, clause-chaining, auxiliaries and serial verbs are excluded from the category of ""light-verb"". The verb needs to be sufficiently productive, it cannot only concern a few instances. It is uninteresting whether the predicating element is of nominal/verbal/other root. This means for example that what is described in the literature as ""co-verb constructions"" most likely are a subcategory of light verbs. It is also uninteresting for the definition of light-verbs whether or not the non-finite predicating element can occur outside the construction or not, both scenarios are acceptable. The category of light verbs cannot all consist of constructions describing states, there has to be at least a few dynamic events. There should also be instances where it is hard to define whether the non-finite predicating element (adjunct) is clearly nominal or not."	1		Lameen Souag (p.c. 2023)	Siwi has a limited number of light-verb constructions.	verb, noun, auxiliary?	predication, derivation	specialized construction	1	GB123		JR
Is incorporation of nouns into verbs a productive intransitivizing process?	1: present, 0: absent	"Can transitive verbs become intransitive by means of noun incorporation, and is this process productive? This need not be the default productive way of intransitivizing nouns, but the process needs to be productive. The incorporated noun is the direct object of the verb. For example: ""he was painting the bike"" = ""he was bike-painting"". Noun incorporation where the noun is acting as modifier do not count, such as ""she was running like Jacob runs"" = ""she was Jacob-running"". If it is necessary to still overtly mark the direct object, for example with a pronoun that this does not count."	0		Vycichl (2005:1-258)		noun, verb	valency change, derivation	specialized construction, compounding and incorporation	2	GB124		
Is there productive incorporation of non-nominal elements (adjectives, locatives, etc.) into verbs?	1: present, 0: absent	"This question does not concern grammatical LOC-marking on verbs, but the incorporation of lexical items. Auxiliaries are also included in ""verbs""."	0		Vycichl (2005:1-258)		verb, adjective, other lexeme	derivation	specialized construction, compounding and incorporation	2	GB125		
Is there one or more existential verb?	1: present, 0: absent	Is there an element expressing existential or locational predication, that is different from the equative or attributive copula? It is possible that there are more than one existential/locational element making further distinctions, temporary versus permanent existence or a special marker for negative existence. Different positional verbs do not count here. The existential/locational marker can be used for the expression of other functions, such as aspect, as long as it is not identical to the copula of identity or attribution.	1		Souag (2010:240, 430-431)		verb, auxiliary	predication, verb classification	specialized construction, phonologically independent item	3	GB126		
Are there positional (classificatory) verbs?	1: present, 0: absent	Is it obligatory to mark position when denoting location, i.e. do you have to say 'the X sits/stands/lies/etc. on the table'? Note that for (1) this needs to be obligatory. This feature concerns inherent lexical properties, not if there is productive morphology to mark position (that is F116).	0		Souag (2010:262)	Not explicitly mentioned; inferred from example.	verb	verb classification, nominal classification, deixis	suppletion, agreement	2	GB127		
Is there a notably small number, i.e. about 100 or less, of verbs in the language?	1: present, 0: absent	This is not always explicitly stated by the descriptive work, but an investigation into texts and wordlists should reveal this.	0		Souag (2010:1-519)		verb	verb classification	paradigm	1	GB129		
What is the pragmatically unmarked order of S and V in intransitive clauses?	multistate 1: SV; 2: VS; 3: both	All questions concerning order of elements aim to capture the pragmatically unmarked order. Do not consider 'left or right-dislocation', accompanied by intonational signals or pragmatically marked constructions such as focus.	1		Vycichl (2005:449)		clause	predication	word order	4	GB130		
Is a pragmatically unmarked constituent order verb-initial for transitive clauses?	1: present, 0: absent	All questions concerning order of elements aim to capture the pragmatically unmarked order. Do not consider 'left or right-dislocation', accompanied by intonational signals or pragmatically marked constructions such as focus.	0		Vycichl (2005:449)		clause	predication	word order	3	GB131		
Is a pragmatically unmarked constituent order verb-medial for transitive clauses?	1: present, 0: absent	All questions concerning order of elements aim to capture the pragmatically unmarked order. Do not consider 'left or right-dislocation', accompanied by intonational signals or pragmatically marked constructions such as focus.	1		Souag (2010:449)		clause	predication	word order	3	GB132		
