Feature question in English	Value set	Clarifying comments to outsiders (from the proposal by Jeremy, Hannah and Hedvig)	Value	Suggested standardised comments in dropdown menu form	Source	Comment	Relevant unit(s)	Function	Formal means	Standardised comments list	Feature_ID	Feature Domain	Contributed_Datapoints
													
Are there definite or specific articles?	1: present, 0: absent	"An article is a marker that accompanies the noun and expresses notions such as (non-)specificity, (in)definiteness and information status (new or given status). Sometimes these notions of specificity, definiteness and information status are summed up in the term ""identifiability"". Articles cannot occur independently, though they might be homophonous with pronouns or numerals that can. A language does not necessarily have both a non-specific/indefinite and a specific/definite marker. These markers often stem from very different sources (numerals and demonstratives) and need not be similar in formal expression or position.
 Formal expression is irrelevant; articles can be free, bound, or marked by suprasegmental markers such as tone.
 Articles are different from demonstratives in that demonstratives occur in a paradigm where there are markers that have a clear spatial deictic function. As demonstratives can grammaticalize into definite or specific articles, they form a natural continuum making it hard to define discrete categories. Articles are more grammaticalized, i.e. are often obligatory in certain contexts that require definite or specific reference. Definite or specific articles can also grammaticalize from pronouns meaning 'a certain'. As articles necessarily accompany nouns, it is in these cases that it is necessary to investigate whether the marker can occur independently or not; if it can it is most likely a pronoun and not an article. Articles can be homophonous with pronouns and demonstratives. See discussions on multifunctionality and take an informed stance in the language-specific case whether these markers are homophonous or polysemic."	1		Vycichl (2005:178, 196); Souag (2013:80-82)	Indefiniteness and definiteness are marked on the noun via stress: ultimate stress marks the indefinite, penultimate stress marks the definite.	article	definiteness	phonologically independent item, affixation and cliticization, declension	5	GB020		JR
Is an indefinite NP obligatorily accompanied by an indefinite (or non-specific) article?	1: present, 0: absent	In this question we need explicit support that indefinite NPs cannot occur without an indefinite/non-specific article. Personal names are excluded here, they do not suffice for a 'yes' (1).	1		Vycichl (2005:178, 196); Souag (2013:80-82); Lameen Souag (p.c. 2023)	Indefiniteness and definiteness are marked on the noun via stress: ultimate stress marks the indefinite, penultimate stress marks the definite.	article, NP	definiteness	phonologically independent item, affixation and cliticization, declension	3	GB021		JR
Are there prenominal articles?	1: present, 0: absent	All questions concerning order of elements aim to capture the pragmatically unmarked order. Do not consider 'left or right-dislocation', accompanied by intonational signals or pragmatically marked constructions such as focus.	0		Vycichl (2005:196)		article, NP	definiteness	phonologically independent item, affixation and cliticization, word order, declension	5	GB022		
Are there postnominal articles?	1: present, 0: absent	All questions concerning order of elements aim to capture the pragmatically unmarked order. Do not consider 'left or right-dislocation', accompanied by intonational signals or pragmatically marked constructions such as focus.	0		Vycichl (2005:196)		article, NP	definiteness	phonologically independent item, affixation and cliticization, word order, declension	5	GB023		
What is the order of numeral and noun in the NP?	multistate 1; Num-N; 2: N-Num; 3: both.	What is the pragmatically unmarked order of the cardinal numeral and the noun?	1		Vycichl (2005:207)		numeral, NP	quantification	word order	4	GB024		
What is the order of demonstrative and noun in the NP?	multistate 1: Dem-N; 2: N-Dem; 3: both.	All questions concerning order of elements aim to capture the pragmatically unmarked order. Do not consider pragmatically marked constructions such as focus.	2		Vycichl (2005:223); Souag (2013:146); Lameen Souag (p.c. 2023)	The demonstrative pronoun follows the noun.	demonstrative, NP	deixis	word order	6	GB025		JR
Are there 'discontinuous noun phrases'?	1: present, 0: absent	"This is a question concerns the structure of the NP. Can you, for example, say ""The man is running big"" and the like to mean ""The big man is running"". Typically a language which allows this has extensive agreement systems so that you can still work out what modifies what in the NP without them being adjacent. > i.e. the ""Australian type"". NPs that are made up of several coordinated NPs that can be interpreted by the verb or other elements are not relevant here, this features aims to capture NPs where the head and modifiers can be separated. Examples of the type ""I painted the house red"" or ""I saw the boy big"" are not necessarily discontinuous, but most likely resultative or contrastive (""I saw the boy big [as opposed to before when he was small]"")."	?		Souag (2010:1-519)		adjective, NP	attribution	word order	1	GB026		
Is there a difference between the marking of NP coordination ('John and Mary went to market') and the marking of comitative phrases ('John went to market with Mary')?	1: present, 0: absent	This is not always explicitly stated by the descriptive work, but an investigation into the examples and perhaps even appendixed text of the grammar should reveal this (to a certain extent).	0		Souag (2010:468)		noun, NP, case marker	coordination, argument marking - oblique	affixation and cliticization, phonologically independent item, declension	1	GB027		
Is there an inclusive/exclusive distinction?	1: present, 0: absent	Is there a pronoun or other marker that explicitly marks the inclusion of an interlocutor? It could be that only inclusion is differentiated and not exclusion, exclusion does not have to be overtly marked for (1) here. This feature is not restricted to the pronominal system but includes verbal marking as well. This means that if is not in a direct dependency relation to F29.	0		Vycichl (2005:216)		pronoun, bound person form	number	paradigm, declension, bound person marking	1	GB028		
Is there a gender distinction in 3rd person pronouns (or demonstratives, if no 3rd person pronouns)?	1: present, 0: absent	This is often natural gender (masc./fem), but it could be animacy as well. If pronouns of inanimate nouns agree with the gender/noun class of that noun that will suffice for (1) here.	1		Vycichl (2005:216)		demonstrative, pronoun	pronominal gender	paradigm, declension	1	GB030		
Is there a dual (or unit augmented) in addition to a plural (or augmented) number category in pronouns?	1: present, 0: absent	This needs to be a category that is present for all persons, i.e. 29:1 -> 31:1 is not (necessarily) true	0		Vycichl (2005:216)		pronoun	number	paradigm, declension	1	GB031		
Are 1st and 2nd persons conflated in any context?	1: present, 0: absent	Excluding honorifics.	0		Vycichl (2005:216)		pronoun, bound person form	person, TAM, negation	paradigm, declension, bound person marking	3	GB032		
Are person categories neutralized under some conditions?	1: present, 0: absent	In this question we mean all person categories, not just one person. It could for example be that person-marking entirely disappears under negation. Excluding honorifics and imperatives and non-finite forms of verbs.	?		Vycichl (2005:1-258)	Not discussed.	pronoun, bound person form	person, TAM, negation	paradigm, declension, bound person marking	4	GB034		
Is there an opposition between three or more distance terms in the demonstrative system?	1: present, 0: absent	Demonstratives are markers of a small set This doesn't have to be only Euclidean distance (meters, inches etc.), it could also be concerned with near or far in relation to the interlocutors (cf. Wolof). If the system of demonstratives includes a marker that is anaphoric this does not count as a third distance.	1		Souag (2010:255)	Proximal, medial, and distal.	demonstrative	deixis	paradigm, declension, suppletion	2	GB035		
Is elevation morphologically marked in demonstratives?	1: present, 0: absent	Elevation is concerned with how high up or low an object is, altitude.	0		Vycichl (2005:198)		demonstrative	deixis	paradigm, declension, suppletion	1	GB036		
Is the opposition visible-non-visible marked on demonstratives?	1: present, 0: absent	Is there a distinction visible-non-visible when referencing to items that are in the same relative distance, i.e. it is not relevant that demonstratives denoting far away reference often also imply non-visibility.	0		Vycichl (2005:198)		demonstrative	deixis	paradigm, declension, suppletion	1	GB037		
Are there demonstrative classifiers?	1: present, 0: absent	Please note, this does NOT concern agreement with the noun class but a separate nominal classification system. This question concerns whether there exists a independent classifier system in demonstratives that is not related to the gender/noun class systems. This classifier system can however be symmetrical with numeral, possessive or verbal classifiers.	0		Vycichl (2005:1-258)		classifier, demonstrative	nominal classification	phonologically independent item, declension, agreement	3	GB038		
Are there declensions (partly) determined by number of the noun?	1: present, 0: absent	Is there nonphonological allomorphy of noun number markers? Are there, for example in the case of large noun class systems, different markings of number that does not correlate with different markings of singular, i.e. are there new groups in the plural that are not aligned with the singular groups?	1		Vycichl (2005:200-205)	There are a number of masculine and feminine plural suffixes and Arabic irregular/internal plural forms.	noun	number, nominal classification	?	4	GB039		
Are there nouns which are suppletive for number?	1: present, 0: absent	Only answer (1) if there are more than two examples of this. Body-parts and kinship terms are good place to start investigating.	1		Vycichl (2005:203); Souag (2013:64); Souag (p.c. 2023)	Vycichl (2005) as well as Souag (2013) give examples for nouns that are suppletive for number.	noun	number	suppletion	1	GB041		JR
Can singular number be marked on the noun itself?	1: present, 0: absent	This is meant to capture marking on a open set of nouns, not a restricted set. Absence of plural marking or marking on the entire NP is not enough for (1) here. Nouns derived from adjectives or verbs are not relevant here.	1		Vycichl (2005:200-207); Souag (2013:91); Souag (p.c. 2023)	Number can be marked on the noun with prefixes expressing gender and number, e.g. 'a-'/'ta-' indicating singular number.	noun	number, nominal classification	declension	2	GB042		JR
Can dual number be marked on the noun itself?	1: present, 0: absent	This is meant to capture marking on a open set of nouns, not a restricted set. Marking on the entire NP or reduplication is not enough for (1) here. Nouns derived from adjectives or verbs are not relevant here.	0		Vycichl (2005:198); Souag (2010:186-188); (2013:113-115); Lameen Souag (p.c. 2023)	There is a nominal dual marking suffix '-en', but it only occurs with a restricted set of nouns, i.e., a subset of measure nouns.	noun	number	declension	2	GB043		JR
Can plural number be marked on the noun itself?	1: present, 0: absent	This is meant to capture marking on a open set of nouns, not a restricted set. Marking on the entire NP or reduplication is not enough for (1) here. Nouns derived from adjectives or verbs are not relevant here.	1		Vycichl (2005:200-204)		noun	number, nominal classification	declension	2	GB044		
Are there associative plurals?	1: present, 0: absent	"Is there a marker on the noun that instead of marking additive plural ""several X"" marks that the reference contains entities associated with X, ""X and other people/things associated with X’."	0		Vycichl (2005:198-206)		noun, pronoun	number	declension	1	GB046		
Is there a productive morphologically marked Action/state nominalization (arrive/arrival)?	1: present, 0: absent	"Arrive -arriving would also serves as an example, or 'La concentracio´n de Sherlock Holmes duro´ cinco horas' - ‘Sherlock Holmes’ concentration lasted five hours’. Productive compounding with nouns is not sufficient for a ""yes ""in F47."	1		Souag (2010:420)		noun, verb	derivation, nominal classification	affixation and cliticization, infixation, tone, alternation, reduplication	3	GB047		
Is there a productive morphologically marked Agentive nominalization (sing-er)?	1: present, 0: absent	"Productive compounding with words meaning “person” is not sufficient for a ""yes ""in F48."	1		Souag (2010:421)		noun, verb	derivation	affixation and cliticization, infixation, tone, alternation, reduplication	3	GB048		
Is there a productive morphologically marked Object nominalization (sing; song)?	1: present, 0: absent	"Productive compounding with words meaning “thing” is not sufficient for a ""yes ""in F49."	1		Souag (2010:420)		noun, verb	derivation	affixation and cliticization, infixation, tone, alternation, reduplication	3	GB049		
Is sex a relevant category in any noun class/gender system?	1: present, 0: absent	Relevant category here does not have to mean that it's the absolute deciding factor when assigning a noun to a certain gender/NC, but that there is a clear preference for certain nouns to have a certain gender/NC.	1		Vycichl (2005:198)		noun	nominal classification	paradigm	3	GB051		
Is shape a relevant category in any noun class/gender system?	1: present, 0: absent	Relevant category here does not have to mean that it's the absolute deciding factor when assigning a noun to a certain gender/NC, but that there is a clear preference for certain nouns to have a certain gender/NC.	0		Vycichl (2005:198)		noun	nominal classification	paradigm	3	GB052		
Is animacy (without reference to sex) a relevant category in any noun class/gender system?	1: present, 0: absent	Relevant category here does not have to mean that it's the absolute deciding factor when assigning a noun to a certain gender/NC, but that there is a clear preference for certain nouns to have a certain gender/NC.	0		Vycichl (2005:198)		noun	nominal classification	paradigm	3	GB053		
Is plant status a relevant category in any noun class/gender system?	1: present, 0: absent	Relevant category here does not have to mean that it's the absolute deciding factor when assigning a noun to a certain gender/NC, but that there is a clear preference for certain nouns to have a certain gender/NC.	0		Vycichl (2005:198)		noun	nominal classification	paradigm	3	GB054		
Are there numeral classifiers?	1: present, 0: absent	This does not concern whether or not numerals agree with the noun class of the head they modify. This question concerns whether there exists a independent classifier system in numerals that is not related to the other classifier systems.	0		Vycichl (2005:1-258)		classifier, noun, NP, numeral	nominal classification, quantification	phonologically independent item, affixation and cliticization, declension, agreement	4	GB057		
Are there possessive classifiers?	1: present, 0: absent	This does not concern whether or not possessive markers agree with the noun class of the possessum. This question concerns whether there exists a independent classifier system in possessive markers that is not related to the other classifier systems. We are concerned both with markers that signal the nature of the possessor or the possessum, and the relationship between them. Differences in the expression of individual, joint, separate and group possession is not relevant here. This feature applies to both pronominal and nominal possessors. Possessive classifiers need not be obligatory, it can also be possible to construct possessive phrases with no classification of nominals into different categories.	0		Vycichl (2005:1-258)		classifier, noun, NP, pronoun	nominal classification, attributive possession, attribution	phonologically independent item, affixation and cliticization, declension, agreement	4	GB058		
Is alienable/inalienable a relevant distinction?	1: present, 0: absent	Is there a morpho-syntactic difference in attributive possession that can be attributed to alienability? This feature applies to both pronominal and nominal possessors.	1		Souag (2013:162); Vycichl (2005:217pp.); Souag (p.c. 2023)	Nominal possession is generally marked with the genitive preposition 'n'. For inalienable nouns, the possessor noun is additionally marked with possessive pronominal suffixes. If the possessor is pronominal, the possessed noun is marked with possessive suffixes for both inalienable and alienable possession. These possessive suffixes are different for inalienable and alienable possession.	noun, NP, pronoun	attributive possession, attribution	affixation and cliticization, phonologically independent item, declension	1	GB059		JR
Can possession be marked by a prefix?	1: present, 0: absent	Attributive possession on either the possessor or possessum. This feature applies to both pronominal and nominal possessors.	1		Vycichl (2005:207)	The normally free standing preposition can be assimilated to the noun it precedes and be prefixed.	noun, NP, pronoun	attributive possession, attribution	affixation and cliticization, declension	2	GB061		
Can possession be marked by a suffix?	1: present, 0: absent	Attributive possession on either the possessor or possessum. This feature applies to both pronominal and nominal possessors.	1		Vycichl (2005:217)	Suffixed pronouns indicate the possessor.	noun, NP, pronoun	attributive possession, attribution	affixation and cliticization, declension	2	GB062		
Can possession be marked on the nominal possessor?	1: present, 0: absent	Attributive possession only. This feature applies to both pronominal and nominal possessors.	1		Vycichl (2005:207)	Possession is marked by the preposition 'of' preceding the possessor. The preposition may be assimilated and prefixed to the noun denoting the possessor.	noun, NP, pronoun	attributive possession, attribution	declension	2	GB063		
Can possession be marked on the nominal possessee?	1: present, 0: absent	Attributive possession only. This feature applies to both pronominal and nominal possessors.	1		Vycichl (2005:217)	The possessor can be suffixed to the possessee in form of a pronoun.	noun, NP, pronoun	attributive possession, attribution	declension	2	GB064		
What is the order of possessor and possessed in the attributive possessive construction?	multistate 1:Possessor-Possessed; 2:Possessed-Possessor; 3: both	In a pragmatically unmarked construction, i.e. not focus. This feature applies to both pronominal and nominal possessors.	2		Vycichl (2005:207)		noun, NP, pronoun	attributive possession, attribution	word order	2	GB065		
Do core adjectives (defined semantically as property concepts; value, shape, age, dimension) act like verbs in predicative position?	1: present, 0: absent	"Do elements expressing predicate adjectival meaning take on verbal morphology? The adjectival roots need not take exactly all verbal marking, if there is at least some marking that verbal and adjectival roots share then there is a yes here. For example: ""he runs"" and ""he greens""."	0		Souag (2010:154)		adjective, clause, verb	predication, number, person, nominal classification, TAM	declension, conjugation, agreement, bound person marking	3	GB068		
Do core adjectives (defined semantically as property concepts; value, shape, age, dimension) used attributively require the same morphological treatment as verbs?	1: present, 0: absent	Do elements expressing attributive adjectival meaning receive the same treatment as verbs when verbs are used attributively, i.e. inside an NP? The adjectival roots need not take exactly all verbal marking. If there is at least some marking that verbal and adjectival roots share then there is a yes here. The result need not be finite, participles would count if that is the way verbs are marked when used attributively. This means that if the language in question forms modifying verbs by participles (“running man”) and this is the same for adjectival roots (“redding man”) then there is a yes here.	?		Souag (2010:1-519)	Verbs in attributive function are not discussed.	adjective, clause, verb	attribution, number, person, nominal classification, TAM	declension, conjugation, agreement, bound person marking	3	GB069		
Is there case marking for core nominal NPs (i.e., S, A or O function)?	1: present, 0: absent	Core NPs are the NPs required by the verb to be present, typically S, A or O.	0		Souag (2010:126)		noun, NP, case marker	argument marking - core	declension, case marking	2	GB070		
Is there case marking for core pronouns?	1: present, 0: absent	Core pronouns are the NPs required by the verb to be present, typically S, A or O.	0		Vycichl (2005:216); Souag (2013:46); Lameen Souag (p.c. 2023)	The case-marked forms are morphologically bound.	NP, pronoun, case marker	argument marking - core	declension, case marking	2	GB071		JR
Is there case marking for oblique nominal NPs?	1: present, 0: absent	Oblique NPs are NPs not required by the verb to be present, adverbial information, locative phrases, temporal phrases etc. Oblique case is defined as any bound marking that relates the role of the argument to the predicate - that is not core (S, A or O).	?		Vycichl (2005:208); Souag (163); Lameen Souag (p.c. 2023)	According to Vycichl (2005), dative case is marked with the preposition i- (y-/ye-) on the noun. Souag (2013) analyzes this preposition as a separate word. 	noun, NP, case marker	argument marking - oblique	declension, case marking	2	GB072		JR
Is there case marking for oblique pronouns?	1: present, 0: absent	Oblique pronouns are NPs not required by the verb to be present, adverbial information, locative phrases, temporal phrases etc. There are cases where obliques can express emphasized as core arguments. If these contexts are pragmatically marked they do not trigger a no (0) in F73 as there is still a distinction between core prototypical neutral core arguments and obliques. Oblique case is defined as any bound marking that relates the role of the argument to the predicate - that is not core (S, A or O). We explicitly exclude “genitive” from oblique cases since it is not concerned with the role of the argument to the predicate but within an NP. Languages can have oblique case without also having core case.	1		Vycichl (2005:216)		NP, pronoun, case marker	argument marking - oblique	declension, case marking	2	GB073		
Are there prepositions?	1: present, 0: absent		1		Vycichl (2005:246)		adposition	argument marking - core, argument marking - oblique	phonologically independent item	4	GB074		
Are there postpositions?	1: present, 0: absent		0		Souag (2010:306)		adposition	argument marking - core, argument marking - oblique	phonologically independent item	4	GB075		
Are there adpositions to mark core NPs?	1: present, 0: absent	Core NPs are the NPs required by the verb to be present, typically S, A or O. We are not to count the arguments of non-prototypical clause types, such as copula, existential verbs or predicative possessive constructions that are construed with copulas or existential verbs as core arguments.	0		Vycichl (2005:220)		adposition, NP, case marker	argument marking - core	phonologically independent item	3	GB076		
Are there adpositions to mark oblique NPs?	1: present, 0: absent	Oblique NPs are NPs not required by the verb to be present, adverbial information, locative phrases, temporal phrases etc. Oblique function is defined as marking that relates the role of the argument to the predicate - that is not core (S, A or O). We explicitly exclude “genitive” from oblique cases since it is not concerned with the role of the argument to the predicate but within an NP. Languages can have oblique adpositions without also having adpositions or case marking core arguments.	?		Vycichl (2005:)		adposition, NP, case marker	argument marking - oblique	phonologically independent item	3	GB077		
Do verbs have prefixes/proclitics, other than those that ONLY mark A, S or O (do include portmanteau: A & S + TAM)?	1: present, 0: absent	"The portmanteau morphemes in questions could be of person, number or TAM or markers of reciprocity, location, benefactive, direction etc. If there are affixes devoted to TAM solely these are also counted. Person markings expression more than one argument, relative markers or relative pronouns are also included here if they form a phonological units with the root. The outcome of this affixation has to be a verb, i.e. a affix that makes a verb into an instrumental noun for example would not count. This feature is not logically triggered by the following features, but if you have coded ""1"" for either of these you are advised to consider whether it would also result in a ""1"" for this feature: 152, 101, 151, 149, 82, 83, 84, 87, 88, 107, 104, 103, 147, 148, 114 and 115. The reason why there is no strict logical dependency is because while they all deal with markings on the verb, these can theoretically be other markings than prefixes, proclitics, enclitics or suffixes (reduplication, tone and suppletion). Since this kind of marking is rare, we recommend all coders being aware of this link even though it is not technically a strict dependency."	1		Vycichl (2005:226-227)		verb, bound person form, portmanteau morpheme	argument marking - core, argument marking - oblique, TAM	affixation and cliticization, bound person marking, conjugation	3	GB079		
