Is a pragmatically unmarked constituent order verb-final for transitive clauses?	1: present, 0: absent	All questions concerning order of elements aim to capture the pragmatically unmarked order. Do not consider 'left or right-dislocation', accompanied by intonational signals or pragmatically marked constructions such as focus.	0		Souag (2010:449)		clause	predication	word order	3	GB133		
Is the order of constituents the same in main and subordinate clauses?	1: present, 0: absent	This is not always explicitly stated by the descriptive work, but an investigation into the examples and perhaps even appendixed text of the grammar should reveal this (to a certain extent). There might be asymmetries caused by TAME, negation or certain other markers; make sure you look through many different examples.	1		Souag (2010:390)	Not explicitly mentioned; inferred from example.	sentence, clause	predication, subordination	word order	4	GB134		
Do clausal objects occur in the same position as nominal objects?	1: present, 0: absent	By clausal objects here we mean clauses that are directly governed by a finite verb (typically verbs of 'wanting', 'saying' etc.). In other words, complement subordinate clauses and not relative. The question aims at discerning whether they are treated like prototypical nominal direct objects, not indirect or obliques. This is not always explicitly stated by the descriptive work, but an investigation into the examples and perhaps even appendixed text of the grammar should reveal this. There might be asymmetries caused by TAME, negation or certain other markers, make sure you look through many different examples.	1		Souag (2010:316-318)	Not explicitly mentioned; inferred from examples.	clause	predication, complementation	word order	1	GB135		
Is constituent order fixed?	1: present, 0: absent	If the word order is non-fixed it is definitely not used to distinguish the semantic roles of arguments (opposite is not true though). Do not consider 'left or right-dislocation', accompanied by intonational signals or pragmatically marked constructions such as focus. Word order can be fixed, but not necessarily the same in all context (it could vary with the nature of the subject, TA, etc.).	1		Souag (2010:449)	Exceptional variation is attested, but the general order is SVO.	clause	predication	word order	2	GB136		
Can negation be marked clause-finally?	1: present, 0: absent	"This feature refers to Standard Negation, i.e. at least the negation of dynamic verbal predicates in declarative mood. This includes suffixes on verb-final clauses, but prefixes on clause-final verbs do not count. Do not include elliptical constructions of the kind ""'Pete didn't""."	0		Souag (2010:437-438)		clause, verb, negator	negation	affixation and cliticization, reduplication, word order, conjugation	3	GB137		
Can negation be marked clause-initially?	1: present, 0: absent	This feature refers to Standard Negation, i.e. at least the negation of dynamic verbal predicates in declarative mood. Do not include elliptical constructions of the kind 'Not Mary'.	0		Souag (2010:436); Lameen Souag (p.c. 2023)	The default order in Siwi is SVO, with negation directly preceding the verb. Clause-initial negation only occurs due to argument omission, pragmatically marked VS order or imperative constructions.	clause, verb, negator	negation	affixation and cliticization, reduplication, word order, conjugation	3	GB138		JR
Is there a difference between imperative and declarative negation?	1: present, 0: absent	This feature covers more than only different negators: different order, loss of finiteness or addition of new elements would also suffice. If the analysis of the language-specific researcher results in two different forms for negative imperative and prohibitive, then we are only concerned with the construction that is fulfilling the traditional imperative function for the coding of F139.	1		Souag (2010:438-439)	The negator is the same, but the verb stem changes in the negative imperative.	clause, verb, negator	negation, prohibition, imperative	affixation and cliticization, infixation, agreement, tone, reduplication, suppletion, alternation, case marking, specialized construction, bound person marking, phonologically independent item, word order	4	GB139		
Are verbal and non-verbal predicates marked by the same negator?	1: present, 0: absent	This feature pertains only to the negative marker itself, be it an independent particle, verb, auxiliary, clitic or affix. By non-verbal here we are referring to locational/existential predication, attributive predication and predicate nouns. Negation of possession, capability or knowing are not included. However, it is very likely that languages that have different negation from the standard negator for these functions also make a distinction between locational/existential and standard.	0		Souag (2010:435)		clause, verb, noun, NP, negator	negation	conjugation, declension, phonologically independent item	5	GB140		
Are S and O conflated morphologically in at least some basic constructions, i.e. simple main clauses?	1: present, 0: absent	This question pertains to alignment of core arguments, bound or free. S & O alignment can be described as a kind of ergative-absolutive pattern. The alignment need not concern the entire person paradigm, if there is conflation in only one person this will suffice for a yes (1). If the language has no case marking of core arguments whatsoever there will be a yes (1) in both F141 and F142.	0		Vycichl (2005:1-258)		clause, noun, NP, case marker	argument marking - core	paradigm, declension, case marking	1	GB141		
Are S and A conflated morphologically in at least some basic constructions, i.e. simple main clauses?	1: present, 0: absent	This question pertains to alignment of core arguments, bound or free. S & A alignment can be described as a kind of nominative-accusative pattern. The alignment need not concern the entire person paradigm, if there is conflation in only one person this will suffice for a yes (1). If the language has no case marking of core arguments whatsoever there will be a yes (1) in both F141 and F142.	1		Vycichl (2005:216, 220)	The independent pronouns can only occur in the position of the A or S participant.	clause, noun, NP, case marker	argument marking - core	paradigm, declension, case marking	1	GB142		
Is there a morpho-syntactic distinction between predicates expressing controlled versus uncontrolled events or states?	1: present, 0: absent	"This marking need not consists of a bound marker on the verb, it encompasses other constructions as well as long as they mark control/voluntariness. This question can be hard to answer negatively with great certainty. Constructions of the kind such as ""sickness hits me"" are included."	0		Souag (2010:1-519)		clause, adjective, verb	argument marking - core	paradigm, conjugation, specialized construction, bound person marking	4	GB146		
Is there a morphologically marked passive construction?	1: present, 0: absent	Is there a marker bound to the verb that encode the derived diatheses in which the agent role is not linked with a subject noun phrase. It is not relevant for this feature whether or not the marking of the agent role in an oblique role is prohibited, i.e. constructions of the kinds found in Finnish and other Uralic languages are also included in passive here.	1		Souag (2010:360)	There is a passive-like anticausative prefix to form the passive.	clause, verb	derivation, valency change	affixation and cliticization, infixation, tone, alternation, reduplication	2	GB147		
Is there a morphologically marked antipassive?	1: present, 0: absent	Is there a marker on the verb that decreases the valency of the verb by omission of (at least) the direct object? In ergative languages this would mean that the ergative agent becomes absolutive, if the marker is applied to a transitive verb.	0		Souag (2010:1-519)		clause, verb	derivation, valency change	affixation and cliticization, infixation, tone, alternation, reduplication	2	GB148		
Is there a morphologically marked inverse?	1: present, 0: absent	"The definition of a direct–inverse language is a matter under research, but it is widely understood to involve different grammar for transitive predicates according to the orders of their ""subject"" and their ""object"" on a person hierarchy, which in turn is some combination of saliency and animacy specific to a given language. The direct construction is the unmarked one. The direct construction is used when the subject of the transitive clause outranks the object in the person hierarchy, and the inverse is used when the object outranks the subject."	0		Souag (2010:1-519)		clause, verb	derivation, valency change	affixation and cliticization, infixation, tone, alternation, reduplication	2	GB149		
Is there clause chaining?	1: present, 0: absent	"Clause-chaining here is not just juxtapositioning of minimal clauses with no connectors, but chains of morphologically stripped-down medial clauses which are dependent on a single clause usually, but not necessarily, final. 
""Clause-Chains (a.k.a Topic Chains, Medial Clauses, etc.) are long series of verbs and verb phrases with incomplete marking (medial clauses) followed by one fully specified verb which provides the missing categories. Only the final verb form may occur freely. Medial verbs are dependent on an independent form."" (Weisser 2013:1)"	0		Souag (2010:1-519)		clause, verb	predication	specialized construction	2	GB150		
Is there a morphologically-marked switch reference system?	1: present, 0: absent	Is there a marker, usually on the verb, that marks if the argument has the same referent as an argument of the following clause.	0		Souag (2010:1-519)		sentence, clause, verb, noun, NP	argument marking - core	affixation and cliticization, infixation, tone, alternation, reduplication	1	GB151		
Is there a morphologically marked distinction between simultaneous and sequential clauses?	1: present, 0: absent	This question is concerned with verbal marking. If sequentially is a secondary function of a imperfective aspect this does not count, it needs to be a devoted marker. The language does not need to express both overtly, one marker devoted to either function will do.	1		Souag (2010:390)		sentence, clause, verb	TAM, sequentiality	conjugation, specialized construction	2	GB152		
Are causatives formed by affixes/clitics?	1: present, 0: absent		1		Souag (2010:359)		verb	causative, valency change, derivation	affixation and cliticization, infixation	2	GB155		
Are causatives formed by constructions involving 'say'?	1: present, 0: absent		0		Souag (2010:359)		verb, serial verb construction	causative, valency change, derivation, predication	specialized construction	1	GB156		
Is there tail-head linkage?	1: present, 0: absent	"Tail-head linkage (THL) is a discourse pattern which consists in repeating, at the beginning of a new sentence, the main verbal root (with or without accompanying material) of the preceding sentence for discourse cohesion. This is a feature that is very striking if the language has it and it should be very evident in at least narratives. Sometimes so called ""Generic THL"" is included in typological surveys of THL, i.e. when the same verbal roots is not repeated but a generic verb (often 'do' or make'). If the language only displays Generic THL then it’s a no (0), it has to be a repetition of the exact same verbal root. Another potentially problematic issue is if the language only displays THL in instructional texts (recipes, rituals etc.). If that is the case, mark it down with a '?' and a comment."	0		Souag (2010:1-519)		sentence, clause, discourse	cohesion	specialized construction	1	GB157		
Are verbs reduplicated?	1: present, 0: absent	"The repetition of phonological material within a word for semantic or grammatical purposes is known as reduplication. In order for there to be a (1) here reduplication needs to be a productive pattern. Both full and partial reduplication count, but if there is only partial the language should be coded with a ""?"" and a comment. The outcome of the process is not relevant, it is the part-of-speech of the roots that matter. As for the distinction between reduplication and repetition we follow the definitions used most often in the literature, i.e. basically Gil (2005): repetition is unconstrained by grammar, can take larger units than words, has an iconic interpretation and can result in more than 2 copies. Reduplication on the other hand is constrained by grammar, usually only concerns 2 copies, is a word-internal process and doesn't necessarily have an iconic interpretation. Reduplication is productive pattern, a few examples of repetition of phonological material does not necessarily constitute evidence of reduplication. The reduplicated elements need not be identical with respect to tone."	0		Vycichl (2005:1-258)		verb	number, TAM, derivation	reduplication	4	GB158		
Are nouns reduplicated?	1: present, 0: absent	"The repetition of phonological material within a word for semantic or grammatical purposes is known as reduplication. In order for there to be a (1) here reduplication needs to be a productive pattern. Both full and partial reduplication count, but if there is only partial the language should be coded with a ""?"" and a comment. The outcome of the process is not relevant, it is the part-of-speech of the roots that matter. As for the distinction between reduplication and repetition we follow the definitions used most often in the literature, i.e. basically Gil (2005): repetition is unconstrained by grammar, can take larger units than words, has an iconic interpretation and can result in more than 2 copies. Reduplication on the other hand is constrained by grammar, usually only concerns 2 copies, is a word-internal process and doesn't necessarily have an iconic interpretation. Reduplication is productive pattern, a few examples of repetition of phonological material does not necessarily constitute evidence of reduplication. The reduplicated elements need not be identical with respect to tone."	?		Vycichl (2005:in passim); Souag (2013:in passim); Lameen Souag (p.c. 2023)	Not discussed in the sources.	noun	number, augmentative, diminutive, derivation	reduplication	4	GB159		JR
Are elements apart from verbs or nouns reduplicated?	1: present, 0: absent	"The repetition of phonological material within a word for semantic or grammatical purposes is known as reduplication. In order for there to be a (1) here reduplication needs to be a productive pattern. Both full and partial reduplication count, but if there is only partial the language should be coded with a ""?"" and a comment. The outcome of the process is not relevant, it is the part-of-speech of the roots that matter. As for the distinction between reduplication and repetition we follow the definitions used most often in the literature, i.e. basically Gil (2005): repetition is unconstrained by grammar, can take larger units than words, has an iconic interpretation and can result in more than 2 copies. Reduplication on the other hand is constrained by grammar, usually only concerns 2 copies, is a word-internal process and doesn't necessarily have an iconic interpretation. Reduplication is productive pattern, a few examples of repetition of phonological material does not necessarily constitute evidence of reduplication. The reduplicated elements need not be identical with respect to tone."	1		Souag (2010:195)		adjective, other lexeme	derivation, number, TAM	reduplication	4	GB160		
Can trial number be marked on the noun itself?	1: present, 0: absent	This is meant to capture marking on a open set of nouns, not a restricted set. Marking on the entire NP or reduplication is not enough for (1) here. Nouns derived from adjectives or verbs are not relevant here.	0		Vycichl (2005:198)		noun	number	declension	2	GB165		
Can paucal number be marked on the noun itself?	1: present, 0: absent	This is meant to capture marking on a open set of nouns, not a restricted set. Marking on the entire NP or reduplication is not enough for (1) here. Nouns derived from adjectives or verbs are not relevant here.	0		Vycichl (2005:198)		noun	number	declension	2	GB166		
Are there logophoric pronouns for the 3rd person?	1: present, 0: absent	Is there a pronoun that marks that the subject of a dependent clause is the same as the subject for the matrix clause? NB, this is a matter of 3rd person pronouns.	0		Souag (2010:1-519)		pronoun, discourse	cohesion	paradigm	1	GB167		
Can an attributive nominal modifier denoting a property concept agree with any gender/noun class of the noun it modifies?	1: present, 0: absent	"""Attributive nominal modifier"" is roughly equal to the old term ""adjective""."	1		Vycichl (2005:209)		adjective, NP	nominal classification	declension, agreement	2	GB170		
Can an adnominal demonstrative agree in gender/noun class with the noun it modifies?	1: present, 0: absent	Demonstratives can agree in gender/noun class with the head noun even if the head noun is not overtly marked for number	1		Vycichl (2005:212)		demonstrative, NP	nominal classification	declension, agreement	2	GB171		
Can articles agree with the gender/noun class of the noun they modify?	1: present, 0: absent	Articles can agree in gender/noun class with the head noun even if the head noun is not overtly marked for number	0		Vycichl (2005:196)		article, NP	nominal classification	declension, agreement	3	GB172		
Can the verb carry a marker of animacy of argument, unrelated to any gender/noun class of the argument?	1: present, 0: absent	This system needs to be unrelated to the gender/noun class system.	0		Souag (2010:1-519)		verb, classifier	nominal classification	conjugation, agreement	3	GB177		
Can an attributive nominal modifier denoting a property concept agree with the number of the noun it modifies?	1: present, 0: absent	"""Attributive nominal modifier"" is roughly equal to the old term ""adjective""."	1		Vycichl (2005:209)		adjective, NP	number, nominal classification	declension, agreement	2	GB184		
Can an adnominal demonstrative agree in number with the noun it modifies?	1: present, 0: absent	Demonstratives can agree in number with the head noun even if the head noun is not overtly marked for number. NB: This concerns cases where there is a head NP different from the demonstrative. Disregard whenever the demonstrative can function as the head noun in the NP, e.g., if demonstratives function as pronouns.	1		Vycichl (2005:212)		demonstrative, NP	number, nominal classification	declension, agreement	2	GB185		
Can articles agree in number with the noun they modify?	1: present, 0: absent	Articles can agree in number with the head noun even if the head noun is not overtly marked for number	0		Vycichl (2005:196)		article, NP	number, nominal classification	declension, agreement	3	GB186		
Is there any productive diminutive marking on the noun (exclude marking by system of nominal classification only)?	1: present, 0: absent	This needs to be a productive pattern. Diminutive function often also entails other meanings, but it needs to minimally encode smaller size.	0		Vycichl (2005:1-258)		noun	derivation, diminutive	affixation and cliticization, infixation, tone, alternation, reduplication	2	GB187		
Is there any productive augmentative marking on the noun (exclude marking by system of nominal classification only)?	1: present, 0: absent	This needs to be a productive pattern. Augmentative function often also entails other meanings, but it needs to minimally encode larger size.	0		Vycichl (2005:1-258)		noun	derivation, augmentative	affixation and cliticization, infixation, tone, alternation, reduplication	2	GB188		
Are the noun's phonological properties relevant for any gender assignment?	1: present, 0: absent	Relevant category here does not have to mean that it's the absolute deciding factor when assigning a noun to a certain gender/NC, but that there is a clear preference for certain nouns to have a certain gender/NC. Phonological properties can be tone, initial consonant etc.	1		Souag (2010:61)	Almost all feminine nouns have the circumfix t-...(-t). Arabic loan words may end in -t and still be masculine.	noun	nominal classification	paradigm	2	GB192		
What is the order of noun and attributive nominal modifier denoting a property concept?	1= ANM - N, 2 = N - ANM, 3 = both, 0 = they cannot be used attributively	"""Attributive nominal modifier"" is roughly equal to the old term ""adjective"", we want to include elements that mark ""adjectival"" function but that might not be described as ""adjectives"", see feature 69."	2		Vycichl (2005:209)		adjective, noun, NP	attribution	word order	3	GB193		
Is there a gender distinction in 2nd person pronouns?	1: present, 0: absent		1		Vycichl (2005:216)		pronoun	pronominal gender	paradigm, declension	1	GB196		
Is there a gender distinction in 1st person pronouns?	1: present, 0: absent		0		Vycichl (2005:216)		pronoun	pronominal gender	paradigm, declension	1	GB197		
Can a numeral used attributively agree with any gender/noun class of the noun it modifies?	1: present, 0: absent		1		Vycichl (2005:213)	Only the numerals for 'one' and 'two' agree in gender.	numeral, NP	nominal classification, quantification	declension, agreement	2	GB198		
"What is the order of the collective universal quantifier (""all"") and the noun?"	0: no UQ, 1: UQ-N, 2: N-UQ, 3: both		2		Souag (2010:196)		quantifier, noun, NP	quantification	word order	2	GB203		
Is there a distinction between collective ('all') and distributive ('every') universal quantifiers?	1: present, 0: absent	This feature pertains both to difference in order and to different markers.	1		Vycichl (2005:223); Souag (2013:124-125); Lameen Souag (p.c. 2023)	Vycichl (2005) glosses 'kul' as 'every/all' which would be accurate for Arabic. According to Souag (2013), 'kul' is used as universal quantifier 'every' and 'nnuba' is used as universal quantifier 'all'.	quantifier, noun, NP	quantification	declension, specialized construction, word order, paradigm	1	GB204		JR
Can predicative possession be formed with a habeo-verb?	1: present, 0: absent	"Is there a verb that expresses predicative possession where the possessor is the subject, the possessum the object and the verb is finite and clearly transitive. The finite element in itself need not be clearly distinct from an existential or locational predicator, the main difference is the argument structure. Transitivity is a language-specific category that needs to be investigated separately to learn whether or not the construction is transitive. In case of languages where transitivity is hard to define it might be beneficial to compare to verbs of ""hold"" and ""grasp"". It is very likely that habeo-verb constructions arise from possessive constructions where the possessor is expressed as a topic (see feature 255)."	0		Souag (2010:236); Lameen Souag (p.c. 2023)		verb,  auxiliary	predicative possession, predication	specialized construction, phonologically independent item	2	GB250		JR
Can predicative possession be formed with a locative possessive?	1: present, 0: absent	"Locative possessive means a construction where the possessum is the subject of an existential/locative predicate and the possessor is in an oblique form marked by an element meaning ""at/in/on"" (i.e. ""a car is on me"") or the locational function is marked on the verb. The possessor-NP need not be overtly marked for location, it can be expressed in the verb itself, i.e. dependent versus head-marking is irrelevant."	0		Souag (2010:236); Lameen Souag (p.c. 2023)		verb, auxiliary, bound person form, adposition, case marker	predicative possession, argument marking - oblique, predication	affixation and cliticization, case marking, bound person marking, phonologically independent item, specialized construction, declension, conjugation	1	GB252		JR
Can predicative possession be formed with a dative possessive?	1: present, 0: absent	"Is the possessum the subject of an existential predicative and the possessor in an oblique form marked by an element meaning ""to/for"" (i.e. ""a car is to me""). The possessor-NP need not be overtly marked for dative case, it can be expressed in the verb itself, i.e. dependent versus head-marking is irrelevant."	1		Souag (2010:236); Lameen Souag (p.c. 2023)		verb, auxiliary, bound person form, adposition, case marker	predicative possession, argument marking - oblique, predication	affixation and cliticization, case marking, bound person marking, phonologically independent item, specialized construction, declension, conjugation	1	GB253		JR
Can predicative possession be formed with a genitive possessive?	1: present, 0: absent	"The possessum is the subject, there is no locational or dative marking of the possessor. The possessor may be construed as a modifier of the possessum (i.e. ""my car exists"")."	0		Souag (2010:236); Lameen Souag (p.c. 2023)		verb, auxiliary, bound person form, adposition, case marker	predicative possession, attributive possession, predication, attribution	affixation and cliticization, case marking, bound person marking, phonologically independent item, specialized construction, declension, conjugation	1	GB254		JR
